"Page","Section","Section Description"
"Home","Navbar",""
"","Hero Header Section","Main landing dashboard showing high-level KPIs, recent activity, and quick access to major modules."
"","Features List Section","Overview of platform features: Dashboards, Analytics, Workflows, Integrations, Compliance, and Industry Modules."
"","Benefits Section","Key benefits of using the platform across FinTech, Healthcare, and Logistics."
"","CTA Section","Prompt to get started, request a demo, or contact support."
"","FAQ Section","Common questions about using the enterprise platform."
"","Testimonial Section","Quotes from enterprise clients in target industries."
"","Stats Section","Impressive usage, uptime, and customer satisfaction statistics."
"","Footer",""
"Authentication & Access","Navbar",""
"","Header Section","Introduction to authentication, security, and access control features."
"","Features List Section","List of authentication methods: SSO, Multi-Factor Authentication (MFA), OAuth, Email/Password."
"","Feature Section","Role-Based Access Control (RBAC) management overview."
"","Feature Section","Session management and device security tracking."
"","CTA Section","Prompt to manage access settings or invite new users."
"","FAQ Section","Answers to common questions about authentication and user access."
"","Footer",""
"Login","Navbar",""
"","Hero Header Section","Central login area with secure authentication form and brand identity."
"","CTA Form Section","Login form fields (email/username, password) with ""Remember Me"" checkbox and ""Login"" button."
"","CTA Section","Links to ""Forgot Password"", ""Request Access"", and ""Contact Support""."
"","FAQ Section","Quick help: troubleshooting login issues, password reset, security tips."
"","Footer",""
"Forgot Password","Navbar",""
"","Header Section","Title and brief instructions for resetting a forgotten password."
"","CTA Form Section","Form for users to enter their registered email address and request a password reset link."
"","FAQ Section","Frequently asked questions about account recovery and password reset process."
"","Footer",""
"User & Organization Management","Navbar",""
"","Header Section","Page header with title, context-switcher (organization/user), and quick actions (e.g., invite user, add department)."
"","Features List Section","Summary of core management areas: Users, Roles & Permissions, Teams/Departments, Organization Settings."
"","Blog List Section","Activity feed or change log specific to user/org management actions (e.g., new user added, permissions changed)."
"","Feature Section","User Directory: Search, filter, and view all users within the organization."
"","Feature Section","Role & Permission Assignment: Assign, edit, and audit user roles and access levels."
"","Feature Section","Team/Department Management: Create, edit, and assign users to teams or departments."
"","Feature Section","Organization Profile: View and edit organizational information, logo, and contact details."
"","Contact Form Section","Invite new user form (modal or side panel accessed from this page)."
"","FAQ Section","FAQs around managing users, teams, and permissions."
"","Testimonial Section","Short testimonial from an admin or manager about ease of user/org management."
"","Footer",""
"User Directory","Navbar",""
"","Header Section","Page header with title ""User Directory,"" user search/filter bar, and access to add/invite new users (if permitted by role)."
"","Features List Section","List of core directory features: advanced filtering, bulk actions, export, and customizable views."
"","Stats Section","Summary stats: total users, active users, pending invites, recently added users."
"","Feature Section","User table/grid displaying users with columns for name, role, status, department, last login, and actions (view, edit, deactivate)."
"","FAQ Section","Answers to common questions about searching, filtering, and managing users."
"","Team Section","Quick links or avatars for key team contacts (admins, managers)."
"","Footer",""